{
  "schema_version": 1,
  "project": {
    "name": "LLM Model Benchmarks",
    "url": "https://github.com/TomkoLabs/LLM-Model-Benchmarks"
  },
  "generated_at": "2026-09-02T18:23:33Z",
  "generation_basis": "latest source-run timestamp (deterministic for unchanged inputs)",
  "source_run_selection": "all discovered runs in timestamp/run-ID order; ranking selects only the exact current primary configured-deployment compatibility group",
  "ranking_rule": "overall score descending, then coding, Hermes, tool/instruction, reliability, and performance scores descending; then timestamp and run ID",
  "result_scope": "Each row describes the complete configured deployment, including its exact resolved reasoning policy, digest, quantization, runtime/template, context, hardware, and harness configuration.",
  "current_standard": {
    "profile": "standard",
    "qualification_generation": "gx10-qualification-v5",
    "scoring_version": "gx10-qualification-v5",
    "benchmark_track": "primary-deployment",
    "reasoning_policy_rule": "configured-per-model",
    "direct_probe_contract": "gx10-direct-probe-v1",
    "direct_probe_max_tokens": 1024,
    "compatibility_group": "group-e8dffb9e2939",
    "upstream_pin_set": "pins-2bbda99377d5",
    "upstream_pins": {
      "benchlocal-cli": "47d1d66d678c893e6f2b6ff7aba448fcc6094e2d",
      "infermark": "f7216dfc5dd67e68dd023e94b389a641c7111eb3",
      "spark-bench": "125ba161d9a91b705ff0cbb22471ac2914d9dea8"
    }
  },
  "source_run_ids": [
    "20260826T055301Z-qwen38-q8-262k-latest-3271673b-smoke",
    "20260826T055553Z-qwen38-q8-262k-latest-3271673b-smoke",
    "20260826T061958Z-qwen38-q8-262k-latest-3271673b-smoke",
    "20260826T063110Z-qwen38-q8-262k-latest-3271673b-standard",
    "20260826T063226Z-qwen38-q8-262k-latest-3271673b-standard",
    "20260826T064422Z-qwen38-q8-262k-latest-3271673b-standard",
    "20260826T110902Z-qwen38-q8-262k-latest-3271673b-standard",
    "20260826T191052Z-agent-main-latest-0960376c-smoke",
    "20260826T191144Z-coder-uncens-latest-ba5d22c1-smoke",
    "20260826T191537Z-agent-main-latest-0960376c-smoke",
    "20260826T191715Z-coder-uncens-latest-ba5d22c1-smoke",
    "20260826T191716Z-coder-uncens-256k-latest-ed8dc6ee-smoke",
    "20260826T191947Z-agent-main-latest-0960376c-smoke",
    "20260826T192424Z-coder-uncens-latest-ba5d22c1-smoke",
    "20260826T192712Z-coder-uncens-256k-latest-ed8dc6ee-smoke",
    "20260826T193633Z-agent-main-latest-0960376c-standard",
    "20260827T012407Z-agent-main-latest-0960376c-smoke",
    "20260827T025027Z-agent-main-latest-0960376c-smoke",
    "20260827T034426Z-agent-main-latest-0960376c-smoke",
    "20260827T041944Z-agent-main-latest-0960376c-smoke",
    "20260827T153654Z-coder-uncens-latest-ba5d22c1-smoke",
    "20260827T154143Z-coder-uncens-latest-ba5d22c1-smoke",
    "20260827T155140Z-coder-uncens-256k-latest-ed8dc6ee-smoke",
    "20260827T155626Z-qwen38-q8-262k-latest-3271673b-smoke",
    "20260827T195214Z-coder-uncens-latest-ba5d22c1-standard",
    "20260827T210708Z-qwen38-q8-262k-latest-3271673b-standard",
    "20260828T003405Z-coder-uncens-256k-latest-ed8dc6ee-standard",
    "20260828T054045Z-ornith15-q8-latest-330554b2-smoke",
    "20260828T054302Z-gemma4-31b-it-bf16-58476611-smoke",
    "20260828T060624Z-ornith15-q8-latest-330554b2-smoke",
    "20260828T152614Z-ornith15-q8-latest-330554b2-smoke",
    "20260828T152940Z-deepseek-v4-flash-f61ff5cf-smoke",
    "20260828T154140Z-deepseek-v4-flash-f61ff5cf-smoke",
    "20260828T165233Z-ornith15-q8-latest-330554b2-standard",
    "20260828T204155Z-deepseek-v4-flash-f61ff5cf-standard",
    "20260831T215915Z-qwen3.8-flash-next-9b17db7a-smoke",
    "20260901T014009Z-qwen3.8-flash-next-9b17db7a-smoke",
    "20260901T014251Z-qwen3.8-flash-next-9b17db7a-smoke",
    "20260901T020003Z-qwen3.8-flash-next-9b17db7a-standard",
    "20260901T155636Z-qwen3.8-flash-next-9b17db7a-smoke",
    "20260901T162913Z-qwen3.8-flash-next-9b17db7a-smoke",
    "20260901T163045Z-qwen3.8-flash-next-9b17db7a-standard",
    "20260901T184158Z-qwen38-q8-262k-latest-3271673b-smoke",
    "20260901T184601Z-qwen38-q8-262k-latest-3271673b-standard",
    "20260902T002055Z-ornith15-q8-latest-330554b2-smoke",
    "20260902T002203Z-ornith15-q8-latest-330554b2-standard",
    "20260902T010018Z-coder-uncens-latest-ba5d22c1-smoke",
    "20260902T010243Z-coder-uncens-latest-ba5d22c1-standard",
    "20260902T034130Z-coder-uncens-256k-latest-ed8dc6ee-smoke",
    "20260902T034318Z-coder-uncens-256k-latest-ed8dc6ee-standard",
    "20260902T043058Z-agent-main-latest-0960376c-smoke",
    "20260902T043355Z-deepseek-v4-flash-f61ff5cf-smoke",
    "20260902T043509Z-deepseek-v4-flash-f61ff5cf-standard",
    "20260902T140420Z-coder-uncens-latest-ba5d22c1-standard",
    "20260902T151036Z-coder-uncens-256k-latest-ed8dc6ee-standard",
    "20260902T161250Z-agent-main-latest-0960376c-standard",
    "20260902T172340Z-deepseek-v4-flash-f61ff5cf-standard"
  ],
  "qualified": [
    {
      "rank": 1,
      "run_id": "20260901T163045Z-qwen3.8-flash-next-9b17db7a-standard",
      "run_count": 1,
      "benchmark_date": "2026-09-01",
      "started_at": "2026-09-01T16:30:45Z",
      "completed_at": "2026-09-01T18:41:38Z",
      "model_identity": {
        "status": "COMPLETE",
        "display_name": "Qwen3.8-Flash-Next Flash-Next [RadixArk/Qwen3.8-Flash-Next-NVFP4] — 125B main + 51B PLE / 6B active (Qwen3.8-Flash-Next sparse MoE) — NVFP4 — 262144-token context — sha256:56d617b9008714d82b491a73c3fc8f86501a2a4dcd17f0b883359762f1af3e17",
        "canonical_name": "Qwen3.8-Flash-Next",
        "source_model": "RadixArk/Qwen3.8-Flash-Next-NVFP4",
        "source_url": "https://huggingface.co/RadixArk/Qwen3.8-Flash-Next-NVFP4",
        "version": "Flash-Next",
        "parameter_variant": "125B main + 51B PLE / 6B active",
        "architecture": "Qwen3.8-Flash-Next sparse MoE",
        "quantization": "NVFP4",
        "context_length": 262144,
        "immutable_digest": "sha256:56d617b9008714d82b491a73c3fc8f86501a2a4dcd17f0b883359762f1af3e17",
        "runtime_variant": "reasoning=none"
      },
      "runtime_alias": "qwen3.8-flash-next",
      "benchmark_track": "primary-deployment",
      "reasoning_policy_selection_mode": "configured",
      "reasoning_policy": "off",
      "profile": "standard",
      "profile_version": "gx10-qualification-v5",
      "scoring_version": "gx10-qualification-v5",
      "outcome": "QUALIFIED",
      "result_validity": "VALID",
      "profile_decision": "MEETS_PROFILE",
      "overall_score": 94.73,
      "component_scores": {
        "coding": 93.6,
        "hermes": 100.0,
        "tool_instruction": 83.333,
        "reliability": 97.9,
        "performance": 100.0
      },
      "infermark_c1": {
        "short": {
          "generation_tokens_per_second": 16.33,
          "generation_tokens_per_second_source": "sparkbench-v6.8-tier2-single-stream",
          "prefill_tokens_per_second": 1116.0,
          "mean_time_to_first_token_seconds": 0.913,
          "estimated_visible_generation_chunks_per_second": 16.443534629915586,
          "mean_time_to_first_visible_chunk_seconds": 0.3124338157164554,
          "end_to_end_visible_output_chunks_per_second": 13.94683099606713
        },
        "medium": {
          "generation_tokens_per_second": null,
          "generation_tokens_per_second_source": null,
          "prefill_tokens_per_second": null,
          "mean_time_to_first_token_seconds": null,
          "estimated_visible_generation_chunks_per_second": 16.500495457737475,
          "mean_time_to_first_visible_chunk_seconds": 0.22597381728701293,
          "end_to_end_visible_output_chunks_per_second": 14.845465085346943
        }
      },
      "duration_seconds": 7853.017,
      "hardware_runtime": "NVIDIA GB10/GX10 model server; split Linux controller/model server (x86_64 controller); vLLM; reasoning=off; mtp=off; kv=BF16/default",
      "upstream_pin_set": "pins-2bbda99377d5"
    },
    {
      "rank": 2,
      "run_id": "20260902T151036Z-coder-uncens-256k-latest-ed8dc6ee-standard",
      "run_count": 1,
      "benchmark_date": "2026-09-02",
      "started_at": "2026-09-02T15:10:36Z",
      "completed_at": "2026-09-02T16:12:44Z",
      "model_identity": {
        "status": "COMPLETE",
        "display_name": "Laguna-S-2.1-Uncensored APEX 2.1 [Laguna-S-2.1-Uncensored APEX] — 117.6B (laguna) — Q6_K — 262144-token context — sha256:ea34631ee5c00f9acd0182cb9503098e96c551e3841bf537bbc69a4576aea84b",
        "canonical_name": "Laguna-S-2.1-Uncensored APEX",
        "source_model": "Laguna-S-2.1-Uncensored APEX",
        "source_url": null,
        "version": "2.1",
        "parameter_variant": "117.6B",
        "architecture": "laguna",
        "quantization": "Q6_K",
        "context_length": 262144,
        "immutable_digest": "sha256:ea34631ee5c00f9acd0182cb9503098e96c551e3841bf537bbc69a4576aea84b",
        "runtime_variant": "reasoning=high"
      },
      "runtime_alias": "coder-uncens-256k:latest",
      "benchmark_track": "primary-deployment",
      "reasoning_policy_selection_mode": "configured",
      "reasoning_policy": "effort:high",
      "profile": "standard",
      "profile_version": "gx10-qualification-v5",
      "scoring_version": "gx10-qualification-v5",
      "outcome": "QUALIFIED",
      "result_validity": "VALID",
      "profile_decision": "MEETS_PROFILE",
      "overall_score": 89.42,
      "component_scores": {
        "coding": 88.6,
        "hermes": 100.0,
        "tool_instruction": 80.0,
        "reliability": 94.8,
        "performance": 50.0
      },
      "infermark_c1": {
        "short": {
          "generation_tokens_per_second": 26.72,
          "generation_tokens_per_second_source": "sparkbench-v6.8-tier2-single-stream",
          "prefill_tokens_per_second": 653.3,
          "mean_time_to_first_token_seconds": 1.566,
          "estimated_visible_generation_chunks_per_second": null,
          "mean_time_to_first_visible_chunk_seconds": null,